{
  "$schema": "https://json-schema.org/draft/2020-12/schema",
  "$id": "https://github.com/Alanjiao1988/J-space-observation/studies/study3r/STATUS.schema.json",
  "title": "Study 3R authoritative lifecycle router",
  "description": "Restrictive schema for studies/study3r/STATUS.json. Every decision-bearing value is pinned with a const, an enum or a null type. additionalProperties is false at every level.",
  "type": "object",
  "additionalProperties": false,
  "required": [
    "schema_version",
    "study_id",
    "namespace",
    "is_authoritative_lifecycle_router",
    "lifecycle_state",
    "terminal",
    "active_protocol",
    "closure_authority",
    "governing_review",
    "rejected_candidate",
    "authorization_flags",
    "research_question_answered",
    "scientific_result_recorded",
    "repository_records",
    "evidence_ledger",
    "zero_operation_counters",
    "next_action_rule",
    "closure_artifacts"
  ],
  "properties": {
    "schema_version": {
      "const": "study3r-status-v1"
    },
    "study_id": {
      "const": "STUDY3R"
    },
    "namespace": {
      "const": "studies/study3r/"
    },
    "is_authoritative_lifecycle_router": {
      "const": true
    },
    "lifecycle_state": {
      "const": "STUDY3R_TERMINAL_CLOSURE_COMPLETE_RESEARCH_QUESTION_UNANSWERED"
    },
    "terminal": {
      "const": true
    },
    "active_protocol": {
      "type": "null"
    },
    "closure_authority": {
      "type": "object",
      "additionalProperties": false,
      "required": [
        "path",
        "bytes",
        "sha256",
        "git_blob",
        "commit",
        "parent_commit",
        "tree",
        "published_alone_as_the_first_commit_after_the_review_disposition"
      ],
      "properties": {
        "path": {
          "const": "studies/study3r/prompts/study3r_terminal_closure_authority.md"
        },
        "bytes": {
          "const": 9236
        },
        "sha256": {
          "const": "5daf943cc1a236715e39c29013addfb3e1b34da54b98ffc4f385ea4ace5f3a99"
        },
        "git_blob": {
          "const": "4ffb72895562be28dbb2ad8d77b6c1cb7050502f"
        },
        "commit": {
          "const": "f3935293d29dac6df0277179ebcdf9f5778d304b"
        },
        "parent_commit": {
          "const": "08c01ff4753b98ad0f43843fc49c93fac68c89da"
        },
        "tree": {
          "const": "d103c3342b8301879d0706f69c71f7a4c4e0c1ae"
        },
        "published_alone_as_the_first_commit_after_the_review_disposition": {
          "const": true
        }
      }
    },
    "governing_review": {
      "type": "object",
      "additionalProperties": false,
      "required": [
        "review_kind",
        "disposition",
        "accepted_as_governing",
        "review_authority_commit",
        "review_evidence_commit",
        "review_disposition_commit",
        "review_disposition_tree",
        "review_json",
        "review_markdown",
        "review_schema",
        "review_receipt",
        "severity_counts",
        "blocking_finding_ids",
        "major_finding_ids",
        "minor_finding_ids",
        "artifact_count",
        "artifacts"
      ],
      "properties": {
        "review_kind": {
          "const": "single_independent_focused_methods_review"
        },
        "disposition": {
          "const": "STUDY3R_PROTOCOL_V1_REJECTED_TERMINAL_NO_EXECUTION"
        },
        "accepted_as_governing": {
          "const": true
        },
        "review_authority_commit": {
          "const": "9952263865694dfafea4f61643e596e193edf4b4"
        },
        "review_evidence_commit": {
          "const": "51754eeb263535ece1ef13af45408a0624b4e7a1"
        },
        "review_disposition_commit": {
          "const": "08c01ff4753b98ad0f43843fc49c93fac68c89da"
        },
        "review_disposition_tree": {
          "const": "0dbf9ab33c19606c12c84a985dfabb93131bc0aa"
        },
        "review_json": {
          "const": "studies/study3r/reviews/study3r_protocol_v1_single_focused_review.json"
        },
        "review_markdown": {
          "const": "studies/study3r/reviews/study3r_protocol_v1_single_focused_review.md"
        },
        "review_schema": {
          "const": "studies/study3r/reviews/study3r_protocol_v1_single_focused_review.schema.json"
        },
        "review_receipt": {
          "const": "studies/study3r/reviews/study3r_protocol_v1_review_receipt.json"
        },
        "severity_counts": {
          "type": "object",
          "additionalProperties": false,
          "required": ["BLOCKING", "MAJOR", "MINOR"],
          "properties": {
            "BLOCKING": {"const": 4},
            "MAJOR": {"const": 5},
            "MINOR": {"const": 2}
          }
        },
        "blocking_finding_ids": {
          "type": "array",
          "minItems": 4,
          "maxItems": 4,
          "uniqueItems": true,
          "items": {"enum": ["F-01", "F-02", "F-03", "F-04"]}
        },
        "major_finding_ids": {
          "type": "array",
          "minItems": 5,
          "maxItems": 5,
          "uniqueItems": true,
          "items": {"enum": ["F-05", "F-06", "F-07", "F-08", "F-09"]}
        },
        "minor_finding_ids": {
          "type": "array",
          "minItems": 2,
          "maxItems": 2,
          "uniqueItems": true,
          "items": {"enum": ["F-10", "F-11"]}
        },
        "artifact_count": {
          "const": 11
        },
        "artifacts": {
          "type": "array",
          "minItems": 11,
          "maxItems": 11,
          "uniqueItems": true,
          "items": {
            "type": "object",
            "additionalProperties": false,
            "required": ["path", "bytes", "sha256", "git_blob"],
            "properties": {
              "path": {"type": "string", "pattern": "^studies/study3r/"},
              "bytes": {"type": "integer", "minimum": 1},
              "sha256": {"type": "string", "pattern": "^[0-9a-f]{64}$"},
              "git_blob": {"type": "string", "pattern": "^[0-9a-f]{40}$"}
            }
          }
        }
      }
    },
    "rejected_candidate": {
      "type": "object",
      "additionalProperties": false,
      "required": [
        "candidate_commit",
        "candidate_tree",
        "candidate_state_at_review",
        "pointer_path",
        "pointer_is_an_internal_pointer_of_the_rejected_candidate",
        "pointer_is_the_current_lifecycle_authority",
        "prospective_readers_must_not_resolve_the_pointer",
        "candidate_frozen",
        "candidate_selected",
        "candidate_executable",
        "candidate_amendable",
        "candidate_bytes_changed_by_this_closure"
      ],
      "properties": {
        "candidate_commit": {"const": "da1ea31b51b784cb1ab3529f9de2f6ee27c853dd"},
        "candidate_tree": {"const": "c1de862ba3782b4930191a51df8790bb4279344c"},
        "candidate_state_at_review": {
          "const": "STUDY3R_PROTOCOL_V1_AUTHORED_AWAITING_SINGLE_INDEPENDENT_FOCUSED_REVIEW"
        },
        "pointer_path": {"const": "studies/study3r/protocol/study3r_protocol_current.json"},
        "pointer_is_an_internal_pointer_of_the_rejected_candidate": {"const": true},
        "pointer_is_the_current_lifecycle_authority": {"const": false},
        "prospective_readers_must_not_resolve_the_pointer": {"const": true},
        "candidate_frozen": {"const": false},
        "candidate_selected": {"const": false},
        "candidate_executable": {"const": false},
        "candidate_amendable": {"const": false},
        "candidate_bytes_changed_by_this_closure": {"const": false}
      }
    },
    "authorization_flags": {
      "type": "object",
      "additionalProperties": false,
      "required": [
        "frozen",
        "execution_authorized",
        "formal_execution_authorized",
        "repair_authorized",
        "amendment_authorized",
        "second_authoring_session_authorized",
        "successor_study_authorized",
        "model_execution_authorized",
        "protocol_v1_1_authorized",
        "protocol_v2_authorized",
        "study3s_authorized",
        "study3m_authorized",
        "study4_authorized",
        "tokenizer_bank_seed_or_interface_operation_authorized",
        "gpu_or_cloud_operation_authorized",
        "rp_b_selection_authorized",
        "github_actions_run_authorized"
      ],
      "properties": {
        "frozen": {"const": false},
        "execution_authorized": {"const": false},
        "formal_execution_authorized": {"const": false},
        "repair_authorized": {"const": false},
        "amendment_authorized": {"const": false},
        "second_authoring_session_authorized": {"const": false},
        "successor_study_authorized": {"const": false},
        "model_execution_authorized": {"const": false},
        "protocol_v1_1_authorized": {"const": false},
        "protocol_v2_authorized": {"const": false},
        "study3s_authorized": {"const": false},
        "study3m_authorized": {"const": false},
        "study4_authorized": {"const": false},
        "tokenizer_bank_seed_or_interface_operation_authorized": {"const": false},
        "gpu_or_cloud_operation_authorized": {"const": false},
        "rp_b_selection_authorized": {"const": false},
        "github_actions_run_authorized": {"const": false}
      }
    },
    "research_question_answered": {
      "const": false
    },
    "scientific_result_recorded": {
      "const": false
    },
    "repository_records": {
      "type": "object",
      "additionalProperties": false,
      "required": [
        "outcome_kind",
        "is_a_negative_scientific_result_about_j_space",
        "is_a_negative_scientific_result_about_reasoning",
        "statement"
      ],
      "properties": {
        "outcome_kind": {"const": "methods_development_failure"},
        "is_a_negative_scientific_result_about_j_space": {"const": false},
        "is_a_negative_scientific_result_about_reasoning": {"const": false},
        "statement": {
          "const": "The repository records a methods-development failure, not a negative scientific result about J-space or reasoning."
        }
      }
    },
    "evidence_ledger": {
      "type": "object",
      "additionalProperties": false,
      "required": ["path", "last_row", "rows_added_by_study3r", "sha256"],
      "properties": {
        "path": {"const": "paper/evidence_ledger.csv"},
        "last_row": {"const": "EV-0016"},
        "rows_added_by_study3r": {"const": 0},
        "sha256": {
          "const": "3821730c45b7a58d3c582b38ba354eae77558fa4d419a51e9ff4fdf120411ff1"
        }
      }
    },
    "zero_operation_counters": {
      "type": "object",
      "additionalProperties": false,
      "required": [
        "model_constructions",
        "weight_files_acquired",
        "forward_passes",
        "prefill_operations",
        "generations",
        "logit_reads",
        "adapter_or_activation_loads",
        "activation_patches",
        "execution_seeds_drawn",
        "scientific_banks_realized",
        "rp_b_selections",
        "scoring_operations",
        "cloud_or_gpu_jobs",
        "evidence_ledger_rows_written",
        "candidate_repairs_or_amendments",
        "successor_authorizations"
      ],
      "properties": {
        "model_constructions": {"const": 0},
        "weight_files_acquired": {"const": 0},
        "forward_passes": {"const": 0},
        "prefill_operations": {"const": 0},
        "generations": {"const": 0},
        "logit_reads": {"const": 0},
        "adapter_or_activation_loads": {"const": 0},
        "activation_patches": {"const": 0},
        "execution_seeds_drawn": {"const": 0},
        "scientific_banks_realized": {"const": 0},
        "rp_b_selections": {"const": 0},
        "scoring_operations": {"const": 0},
        "cloud_or_gpu_jobs": {"const": 0},
        "evidence_ledger_rows_written": {"const": 0},
        "candidate_repairs_or_amendments": {"const": 0},
        "successor_authorizations": {"const": 0}
      }
    },
    "next_action_rule": {
      "type": "object",
      "additionalProperties": false,
      "required": [
        "statement",
        "requires_a_fresh_explicit_project_level_operator_decision",
        "the_decision_must_be_issued_outside_this_terminal_study3r_authority",
        "this_authority_may_issue_it",
        "automatic_amendment_permitted",
        "automatic_successor_permitted",
        "study3r_authorizes_a_successor"
      ],
      "properties": {
        "statement": {
          "const": "Any future restart requires a fresh explicit project-level operator decision issued outside this terminal Study 3R authority."
        },
        "requires_a_fresh_explicit_project_level_operator_decision": {"const": true},
        "the_decision_must_be_issued_outside_this_terminal_study3r_authority": {"const": true},
        "this_authority_may_issue_it": {"const": false},
        "automatic_amendment_permitted": {"const": false},
        "automatic_successor_permitted": {"const": false},
        "study3r_authorizes_a_successor": {"const": false}
      }
    },
    "closure_artifacts": {
      "type": "object",
      "additionalProperties": false,
      "required": ["report_markdown", "closure_json", "closure_schema", "status_schema", "closure_tests"],
      "properties": {
        "report_markdown": {"const": "studies/study3r/STUDY3R_TERMINAL_CLOSURE.md"},
        "closure_json": {"const": "studies/study3r/study3r_terminal_closure.json"},
        "closure_schema": {"const": "studies/study3r/study3r_terminal_closure.schema.json"},
        "status_schema": {"const": "studies/study3r/STATUS.schema.json"},
        "closure_tests": {"const": "studies/study3r/closure/test_study3r_terminal_closure.py"}
      }
    }
  }
}
